"page_id","slug","path","title","content"
"109e9cc4-5a35-4e0f-97f3-42aaaffaef69","home","/","Home","<div id=""pl-6"" class=""panel-layout"">
<div id=""pg-6-0"" class=""panel-grid panel-no-style"">
<div id=""pgc-6-0-0"" class=""panel-grid-cell"" data-weight=""1"">
<div id=""panel-6-0-0-0"" class=""so-panel widget widget_sow-editor panel-first-child panel-last-child"" data-index=""0"" data-style=""{""background_image_attachment"":false,""background_display"":""tile""}"">
<div class=""so-widget-sow-editor so-widget-sow-editor-base"">
<div class=""siteorigin-widget-tinymce textwidget"">
<p class=""text-center"" style=""text-align: left;"">DAILP is a community-based digital archive created to support indigenous peoples' knowledge, interpretations, and representations of the past.&nbsp; DAILP presents reading and writing environments for practicing indigenous languages. DAILP is building a collaborative online space to facilitate communications between indigenous language learners, speakers, and scholars. Contributors can interpret documents and other media housed in partner libraries and museums. The writing environment will allow users to create content presented in digital collections. Our inaugural collection offers insights into Cherokee life and language during the years after allotment in Indian Territory. DAILP code and workflows on GitHub are free. We're happy to help tribal communities stand up their own collectively held and curated archives for language persistence.</p>
<p>We've enhanced and deepened our collection of Cherokee language translations found on DAILP!&nbsp;<strong><i>Cherokees Writing the Keetoowah Way (CWKW)</i></strong> includes all the translations you're familiar with — the Dollie Duncan letters, Echota Funeral Notices, Willie Jumper Stories, and government documents. We've expanded our translations with new letters, funeral notices, stories, and speeches. We've also added new teaching materials in <strong><i>Cherokees Writing the Keetoowah Way (CWKW)</i></strong>.</p>
</div>
</div>
</div>
</div>
</div>
</div>"
"3680bad7-e5a1-47f5-8dfb-dcf706b9fc3a","former-contributors","/about/former-contributors","Former Contributors","<p><strong>Marlene Glass Ballard</strong>&nbsp;is an enrolled United Keetoowah Band of Cherokee Indians in Oklahoma (UKB) tribal member. She is a native first-language speaker and a UKB certified language instructor. Marlene is both fluent and literate in the Keetoowah Cherokee language. She is currently working with the UKB John Hair Cultural Center Keetoowah Language Revitalization Project as a language curriculum developer, translator, and instructor. As part of the language revitalization project, Marlene is collecting traditional short stories as remembered and told by family and tribal elders.</p>

<p><strong>Jeffrey Bourns</strong>, PhD, is an&nbsp;Affiliate Research Scientist in Linguistics at Northeastern University and the former Project Linguist for DAILP. His current research focuses on the linguistic history of Cherokee and the philological treatment of early Cherokee texts.</p>

<p><strong>Joel Dunham</strong>&nbsp;is a Software Developer at Artefactual Systems, Inc. who works on linguistic data management software and digital preservation software. He also works at Concordia University where he builds and maintains the Online Linguistic Database (OLD), an open-source software application that facilitates the collaborative management, analysis, and sharing of linguistic data.</p>

<p><strong>Aparna Dutta</strong>&nbsp;was a linguist on the DAILP team, working primarily with the transcription, translation, and annotation of original Cherokee manuscripts into an online format. She joined the DAILP team in the spring of 2020 and continues to focus on working directly with language data. Aparna is interested in natural language processing with low-resource languages, and the applications of computational linguistics on language documentation and revitalization.</p>

<p><strong>Gibby Free</strong>&nbsp;works primarily on the transcription, translation, and annotation of Cherokee language data. She has previously completed research related to textual analysis tools, and is interested in research related to text classification and summarization. Outside of DAILP, Gibby is a software engineer, and enjoys empowering marginalized communities by connecting them with powerful technical tools.</p>

<p><strong>Jackie Lincroft</strong>&nbsp;was a Research Assistant/Software Engineer working on the main DAILP website. She is majoring in Computer Science and Linguistics and loves incorporating technical skills with interdisciplinary research, working with data, and thinking about how language can be represented digitally.</p>

<p><strong>Brad Montgomery-Anderson</strong>&nbsp;is an Assistant Professor of English at Colorado Mesa University in Colorado. His research focuses on Cherokee language, Mayan languages, and language revitalization. His recent book, the&nbsp;<em>Cherokee Reference Grammar</em>, won the Leonard Bloomfield Book Award for 2017.</p>

<p><strong>Shashwat Patel</strong>&nbsp;was an Interdisciplinary Software Engineer with DAILP. He worked mainly on the website's interface and presentation of various information. He enjoys using software and code to both represent and break down words. In the future he wants to continue working with software development, especially in mobile or web applications. He is also interested in economics.</p>

<p><strong>Kush Patel</strong>&nbsp;was a Web Content Developer for DAILP. He focused on developing and improving the user interface for the main DAILP website. Kush is majoring in Computer Science and Business Administration and is hoping to pursue a career in project management.</p>

<p><strong>Shelby Snead</strong>&nbsp;was the Lead Computational Linguist and UX Designer for DAILP. They managed the technical team and oversaw the digital infrastructure for the project. Shelby is founding Software Engineer at Class Companion. They have extensive software engineering experience and are passionate about&nbsp;<a href=""https://www.gnu.org/philosophy/free-sw.en.html"" target=""_blank"" rel=""noreferrer noopener"">free software</a>, bringing that expertise to language documentation. Shelby is especially interested in integrating a people-first understanding of cultural practices into digital philology and linguistics.</p>

<p><strong>Henry Volchonok</strong>&nbsp;was the project's Web Content Developer and Applied Linguist. He has been focusing on redeveloping our brand image and updating the way we present and integrate our collections with incoming curricular materials. In the future, he hopes to continue working on applied linguistics, specifically in either community-based or forensic contexts.</p>

<p><strong>Hazelyn Aroian</strong>&nbsp;was DAILP's Web Content Developer for the&nbsp;<em>Cherokees Writing the Keetoowah Way</em>&nbsp;digital edition project. She also contributed to maintenance of the main DAILP website with experience in WordPress and graphic design.</p>

<p><strong>Kilie Goins</strong>&nbsp;is a citizen of the Cherokee Nation and a student at the University of Oklahoma studying Linguistics and Information Studies. For DAILP, she focused on processing raw audio of Cherokee speakers reading each document to create a richer learning experience for language learners utilizing the site. Her current research focuses on the Cherokee language from a learner's and scholarly perspective, and she works in the Native American Languages collection at the Sam Noble Museum of Natural History. In the future, she hopes to continue her work with the Cherokee language, focusing on archival linguistics and the interactions between orthography and language learning.</p>

<p><strong>Charlie McVicker</strong>&nbsp;began working with DAILP as a Cherokee audio annotator in Fall 2022 and was a member of DAILP's software development team from early 2023. As a Cherokee Nation citizen, Cherokee second-language learner, and software developer, Charlie has been interested in creating free language learning materials since Summer 2022, when s/he started the Cherokee Language Exercises project, a free website which allows users to practice their language with publicly licensed first-language speaker audio through flashcards and minigames. S/he completed an undergraduate program in Gender, Sexuality, and Women's Studies at Union College. Her undergraduate thesis work focuses on importing frameworks from Queer Theory and (Trans)Gender Studies into projects of theorizing and reclaiming Native Identity and Language in digital spaces. S/he is currently teaching and learning in the Cherokee Language Mentor Apprentice Program in Tahelquah, OK.</p>

<p><strong>Victor Hugo Mendevil&nbsp;</strong>began working with DAILP in Summer 2022 as a Web Content Writer and Editor, primarily focusing on storytelling, communications, and transparency on DAILP's latest ventures and accomplishments, and is a doctoral student in Northeastern University's PhD in English program in Boston. Originally from Seattle, Victor is a direct descendant of the Siksika people with family hailing from the Blackfeet Nation of Montana. He holds an MA in English from Northeastern University, an MFA in Creative Writing from Hofstra University, and a BA in English Language, Literature & Creative Writing from the University of Washington. His research interests pertain to Indigenous literature and storytelling, narrative medicine, disability studies, and creative writing.</p>

<p><strong>Chanmi Oh</strong>&nbsp;was an Interdisciplinary Software Engineer with DAILP as well as a Computer Science and Cognitive Science who pursued a career in human-computer interaction design. She is interested in creating user-friendly technology and contributed to DAILP's front-end interfaces. Chanmi was always glad to support representation of indigenous communities with accessibility in mind!</p>

<p><strong>Melissa Torres</strong>&nbsp;worked on the initial linguistic annotation for DAILP, contributing to the morphemic segmentation and glossing of Cherokee words. She was a combined Psychology and Linguistics major  pursued a career in either speech pathology or social work.</p>

<p><strong>Roy Boney, Jr.</strong>&nbsp;Roy Boney, Jr. ᎯᏂᎦ ᎪᎳᎭ is an award-winning Cherokee artist, filmmaker, illustrator and writer from Tahlequah, OK. He has a Bachelor of Fine Arts in Graphic Design from Oklahoma State University and a Master of Art in Studio Art from the University of Arkansas – Little Rock. He is a Cherokee National Treasure for painting and was designated a Master Artist by the Five Civilized Tribes Museum. His work combines Cherokee language and culture with influences from popular culture. He served as Cherokee Nation language program manager for over a decade before transitioning to Cherokee Film as a Cherokee Language Film and Media Producer. As a member of our Advisory Board, he noted how best to integrate our tools and training into existing language learning programs, and how to design systems and outreach so that they correspond to the needs and opportunities in the community. </p>

<p><strong>Hiroto Uchihara</strong>&nbsp;is Associate Professor in the Graduate School of Global Studies at the <a href=""https://www.tufs.ac.jp/"" target=""_blank"" rel=""noreferrer noopener"">Tokyo University of Foreign Studies</a>. He contributed greatly to our lexical data, and his book,&nbsp;<em>Tone and Accent in Oklahoma Cherokee</em>, is a crucial resource for our project. As a member of our Advisory Board, his expertise with Cherokee linguistics was essential in ensuring the quality of our linguistic data and approaches.</p>

<p><strong>George Miles</strong>&nbsp;was the Curator of the Western Americana Collection at the Beinecke Rare Book and Manuscript Library at Yale University. His responsibilities included acquisition and supervision of materials, as well as education about them.</p>

<p><strong>Patrick Murray-John</strong>&nbsp;is Senior Digital Productions Developer in the Digital Scholarship Group (DSG) at Northeastern University. At DSG, he was responsible for leading the development of CERES, and he brought expertise in open-source software development, user interface, and experience design. For DAILP, he helped to lead enhancements to CERES.</p>

<p><strong>Sarah Sweeney</strong>&nbsp;is the Head of the Digital Production Services (DPS) department in the Northeastern University library. She is responsible for digitizing physical materials and describing digital objects. Sarah, along with others in DPS, helps to manage and maintain Northeastern's Digital Repository Service (DRS). The DRS is the primary storage and discovery tool for Northeastern University's digital assets, which includes documents, photographs, and audio and video files from various Northeastern units. She is skilled in various digital metadata tools, practices, and standards, such as metadata schemas, ontologies, and content modeling. She is also skilled in data transformation tools, such as XSLT, XPath, and OpenRefine, as well as some languages for processing data, like SQL and Python.</p>

<p><strong>Bobbie Gail Scott Smith </strong>is a full-blood, bilingual Cherokee from the Rocky Mountain Community of Adair County, Stilwell, Oklahoma. Cherokee is her first language.&nbsp; She is former First Lady of the Cherokee Nation and Miss Cherokee. She has taught Cherokee for several years in various communities and universities, including Rogers State University, Broken Arrow Community College, &nbsp;Bacone College, and, Northeastern State University. </p>"
"dad54f62-1124-4536-b6db-a5dbae447d2d","goals","/about/goals","Goals","<p>DAILP stands for 'The Digital Archive of Indigenous Language Persistence.' Formerly the Digital Archive of American Indian Language Preservation and Perseverance, our name change reflects our belief that language perseverance and language preservation are closely interconnected and mutually-sustaining efforts, which result in language persistence. Our site presents a proof of concept for DAILP's reading interface using annotated Cherokee documents as a pilot. With the support of our sponsors, we have identified design functions and user configurations in order to create an online interface for community commentary.</p>
<p>The core goals of the Cherokee pilot project are:</p>
<ol>
<li>Deepen our existing <span style=""color: #9d4b42;"">community-centered design</span> workflows in partnership with the three federally recognized Cherokee tribes and representatives from their language programs. Support sustainable programs of transcription, translation and language learning that build on existing efforts within the Cherokee community.</li>
<li>Expand the number of documents collected in our <span style=""color: #9d4b42;"">digital collection</span> of historical Cherokee manuscripts. Transcribe, translate, and annotate documents to adapt them into resources for language learning and for linguistic and historical research, partnering with formal institutions to support ongoing collection development.</li>
<li>Build off of existing transcriptions and annotations to develop and sustain an online environment for contextualized language learning through a robust technical and informational infrastructure.</li>
</ol>
<h3>Community-Centered Design</h3>
<p>In addition to our core team, which consists of Cherokee language experts and linguists, we also work with speakers, archivists, and librarians. We have prototyped an online environment that supports varied reading and language study practices. Our reading interface is enhanced regularly to reflect feedback and recommendations from our team.</p>
<p>The Cherokee community has enhanced DAILP's design, contributing to our site in many ways. DAILP's work since 2015 has focused on developing workflows and infrastructure that align our source texts, translations, and linguistic annotations with descriptive resources and other materials shared with us by the Cherokee tribes and linguistic scholars. We have benefited from free translations of almost 70 Cherokee syllabary documents provided to us by a team of United Keetoowah Band tribal members led by Ernestine Berry and including Clara Proctor, Marlene Ballard, Oletta Pritchett, and the late Opel Foreman. These resources can be referenced from our transcriptions and translations as sources of information about individual words and usage.</p>
<hr />"
"6cfeda87-bd77-463b-9ab0-6def46c27406","project-history","/about/project-history","Project History","<h3>Our Beginnings</h3>
<p>Our initiative arose from and builds on work originating with indigenous peoples themselves. We closely involve tribal representatives in our design and conduct: our results are theirs. Although DAILP is hosted at Northeastern University, all aspects of the pilot of our site and subsequent use of our infrastructure takes their motivation and momentum from the work already being done by and in close collaboration with members of Indigenous Nations and communities.</p>
<p>DAILP builds on a 2014 IMLS SPARKS Ignition planning grant by Dr. Ellen Cushman with Gordon Henry at Michigan State University, ""Analyzing Ojibwe and Cherokee Manuscripts: Proof of Concept for a Digital Archive."" MSU faculty, tribal representatives, and Cherokee and Ojibwe community members created and tested designs for an interface to facilitate the translation of Cherokee and Ojibwe manuscripts housed in archives and libraries around the country.</p>
<p>In 2015 Cushman joined Northeastern University's English Department and began working with the library's Digital Scholarship Group (DSG) to explore the development of a full-scale archive of Cherokee manuscript documents aimed at language learning and language persistence. Linguistic information donated by the Cherokee Nation and linguists Hiroto Uchihara and Brad Montgomery-Anderson has contributed to the lexical data set that informs DAILP's translation process. In 2017-19, Cushman continued to develop collaborative partnerships with key archives and began the process of securing agreements to use materials at Yale's Beinecke Library. The documents presented in the reading interface of DAILP have been freely translated into English by Ernestine Berry and a team from the United Keetoowah Band of Cherokee Indians: Clara Proctor, Oleta Pritchett, Marlene Ballard. In 2021, under a Henry K. Luce Foundation grant, the team gathered initial feedback on the reader interface of DAILP and identified desired features of a collective translation online interface. This interface would facilitate both translation and growth of the current linguistic architecture, expanding the collection.</p>
<h3>Where We Are Now</h3>
<p><a href=""https://dailp.northeastern.edu/"">Our collection</a> contains five different genres of Cherokee writing, including funeral notices, church notes, letters, stories, and government documents. Each document can be viewed in a multi-layered format that presents layers in increasing detail. From the story, pronunciation, and word parts to detailed linguistic analyses of each word, these documents to help readers better understand how words and phrases are created in the Cherokee language. We are working with tribal community partners, scholars, and archivists to make sure that our reading environment allows users to most effectively discover documents, read source documents and translations, search for words, and explore linguistic information.</p>
<h3>Where We're Headed</h3>
<p>Using the digital environment we've created so far, we will continue to work with both Cherokee community members and our advisory board to improve our understanding of how this online learning space can enhance existing language-related practices. We will also identify additional features that would improve translation, as well as language teaching and learning practices. To ensure that DAILP can be useful to a wide variety of audiences, our planning processes are conducted in collaboration with a variety of Cherokee language translators, readers, writers, and learners.</p>
<p>With support from the Henry K. Luce foundation, we are creating audio recordings of each source text to further enhance the site's documentation and presentation of the Cherokee language. We have also began integrating curricular materials onto our website, including exercises for writing practice alongside key cultural knowledge for understanding Cherokee people and culture. These curricular materials use our historical documents to help learners find, read, write, and understand Cherokee in new ways and will soon be expanded with listening exercises.</p>
<p>With support from the National Archives, we are also creating a digital edited collection titled <em>Cherokees Writing the Keetoowah Way</em>. CWKW is rooted in the DAILP manuscript archive and its language data, but presents an expanded collection of documents through a reading framework that foregrounds genre, cultural thematics, scholarly and community contextualization, and commentary.</p>
<p>Our next major goal is to deepen our digital environment with a collaborative translation space where native speakers of the Cherokee language, learners and teachers, and scholars in the field can contribute their knowledge. This will allow users to both annotate documents at the character, word, phrase, and document levels and to discuss these annotations with others as a way of building knowledge and continually developing documentation of the Cherokee language.</p>"
